title,price,rating,oprice,brand
"boAt Xtend Smartwatch Batman Edition with Alexa Built-in, 1.69” HD Display, Multiple Watch Faces, Stress Monitor, Heart & SpO2 Monitoring, 14 Sports Modes, Sleep Monitor, 5 ATM(Knight Black)  ","1,299",4.2,"₹1,299",boAt
Digital Vintage Square Dial Unisex Wrist Watch for Men & Women -W70  ,299,4.1,₹299,CLOUDWOOD
"boAt Flash Edition Smart Watch with Activity Tracker, Multiple Sports Modes, 1.3"" Screen, 170+ Watch Faces, Sleep Monitor, Gesture, Camera & Music Control, IP68 & 7 Days Battery Life(Lightning Black)  ","1,199",4.0,"₹1,199",boAt
"Noise ColorFit Pulse Grand Smart Watch with 1.69""(42.9cm) HD Display, 60 Sports Modes, 150 Watch Faces, Fast Charge, Spo2, Stress, Sleep, Heart Rate Monitoring & IP68 Waterproof (Champagne Grey)  ","1,499",4.0,"₹1,499",Noise
Digital Sports Multi Functional Black Dial Watch for Mens Boys -315RED  ,284,3.8,₹284,Shocknshop
Silicone Strap Analog Wrist Watch for Men (Black/Blue/Red) | LD-BK054  ,397,4.0,₹397,LOUIS DEVIN
"Tokdis MX-1 Pro Bluetooth Calling Smartwatch - 1.69” LCD Display, Multiple Watch Faces, Sleep Monitor, Heart & SpO2 Monitoring, Multiple Sports Modes  ",799,3.1,₹799,Tokdis
SHREENOVA® ID116 Plus Bluetooth Fitness Smart Watch for Men Women and Kids Activity Tracker (Black)  ,278,3.2,₹278,Generic
Analog Day Date Functioning Stainless Steel Chain Watch for Men  ,319,3.8,₹319,TIMEWEAR
"Fire-Boltt Gladiator 1.96"" Biggest Display Smart Watch with Bluetooth Calling, Voice Assistant &123 Sports Modes, 8 Unique UI Interactions, SpO2, 24/7 Heart Rate Tracking (Gold Black)  ","2,499",4.0,"₹2,499",Fire-Boltt
IBS Ultra Seris 8 Smart Watch Men Two Watch NFC Door Unlock Smartwatch Bluetooth Call Wireless Charge Fitness Bracelet (Ultra T-800 Orange)  ,"1,799",3.2,"₹1,799",IBS
"Fire-Boltt Ninja Call Pro Plus 1.83"" Smart Watch with Bluetooth Calling, AI Voice Assistance, 100 Sports Modes IP67 Rating, 240 * 280 Pixel High Resolution (Gold Black)  ","1,699",4.3,"₹1,699",Fire-Boltt
Analog Watches for Women  ,744,4.2,₹744,Sonata
"Bouncefit D20 Y68 Fitness Band Smartwatch – Single Touch Interface, Water Resistant, Workout Modes, Quick Charge Sports Smartwatch for Boys and Girls – Jet Black  ",480,2.9,₹480,Bouncefit
"boAt Flash Edition Smart Watch with Activity Tracker, Multiple Sports Modes, 1.3"" Screen, 170+ Watch Faces, Sleep Monitor, Gesture, Camera & Music Control, IP68 & 7 Days Battery Life(Galaxy Blue)  ","1,199",4.0,"₹1,199",boAt
"Digital 24 Images Projector Watch for Kids Boys Watch, Diwali Gift, Birthday Return Gift, Best Digital Toy Watch for Boy's & Girl's BG-906  ",289,4.0,₹289,ADAMO
"OnePlus Nord Watch with 1.78” AMOLED Display, 60 Hz Refresh Rate, 105 Fitness Modes, 10 Days Battery, SPO2, Heart Rate, Stress Monitor, Women Health Tracker & Multiple Watch Faces [Deep Blue]  ","4,999",3.8,"₹4,999",OnePlus
"Hammer Ace 3.0 Bluetooth Calling Smart Watch with Largest 1.85"" IPS Display, Dual Mode, Spo2, Heart Rate, Strong Metallic Body & Skin Friendly Strap (Black)  ","1,499",4.5,"₹1,499",Hammer
"boAt Newly Launched Wave Armour with 1.83” HD Display, Bluetooth Calling, Rugged Design, HR, SpO2 & Sleep Monitoring, Multiple Sports Modes, Multiple Watch Faces(Olive Green)  ","2,199",4.6,"₹2,199",boAt
Analog Day & Date Display Wrist Watch for Men & Boys (Black)  ,299,3.6,₹299,Matrix
"boAt Wave Style with 1.69"" Square HD Display, HR & SpO2 Monitoring, 7 Days Battery Life, Multiple Watch Faces, Crest App Health Ecosystem, Multiple Sports Modes, IP68(Beige)  ","1,099",3.9,"₹1,099",boAt
"ID-116 Smartwatch for Men's Womens Boys Girls, Bluetooth Smart Fitness Band Watch with Heart Rate Activity Tracker Step & Sports Activity Tracker Smart Watch for  ",270,3.2,₹270,Generic
"Fire-Boltt Ring 3 Smart Watch 1.8 Biggest Display with Advanced Bluetooth Calling Chip, Voice Assistance,118 Sports Modes, in Built Calculator & Games, SpO2, Heart Rate Monitoring (Silver Starlight)  ","1,999",4.2,"₹1,999",Fire-Boltt
Stainless Steel Watch Series Analogue Men's Watch (Black Dial Mens Long Colored Strap) -W219  ,285,3.8,₹285,Shocknshop
Reflex Vox Smartwatch|Alexa Built-in|Bright HD Display|Upto 10 Days Battery|5 ATM Water Resistance|Multiple Sports Modes|100+ Watchfaces|24x7 HRM|Sp02|Stress Monitor|Camera & Music Control  ,"1,994",3.9,"₹1,994",Fastrack
New Fastrack Reflex Beat+ 1.69” UltraVU Display|500 Nits Brightness|60 Sports Modes|24*7 Heart Rate Monitor|SpO2 Monitor|Sleep Tracker|IP68 Water Resistant|Music & Camera Control  ,"1,694",3.9,"₹1,694",Fastrack
"Fire-Boltt 360 SpO2 Full Touch Large Display Round Smart Watch with in-Built Games, 8 Days Battery Life, IP67 Water Resistant with Blood Oxygen and Heart Rate Monitoring  ","1,799",4.0,"₹1,799",Fire-Boltt
Vintage Series Digital Dial Men's & Women's Watch  ,299,2.7,₹299,MIVAAN
Simple Sport Digital Men’s Military Watches Electronic LED Time Black Wrist Watch  ,449,3.8,₹449,Shocknshop
Men's Analog Number Dial Brown Leather Strap Watch  ,248,3.8,₹248,TIMEWEAR
Digital Watch Shockproof Multi-Functional Automatic Black Color Strap Waterproof Digital Sports Watch for Mens Kids Watch for Boys Watch for Men Pack of 1 Watch Water Resistance Digital Watch  ,198,3.8,₹198,SELLORIA
Analogue - Digital Men's Watch (Black Dial Black Colored Strap)  ,799,3.8,₹799,V2A
Krishna Analog Analog Watch - for Boys & Girls  ,224,5.0,₹224,Generic
"Smart Watch for men women boys 1.3"" OLED HD Display, Multiple watch Faces, SpO2 Monitoring, Sleep Monitor for Boys, Girls, Mens, Women & Kids for all Smartphones (ID 116 Plus Black) (ID116 Black)  ",449,4.5,₹449,LOCREST
Multi Dial Chronograph Luxury Quartz Analog Watch for Men  ,339,3.7,₹339,SWADESI STUFF
VMBS A1 Smart Watch Mobile Inbuild Camera Supporting 4G/5G Sim Smartwatch for Phone  ,990,2.5,₹990,VMBS
"Fire-Boltt Visionary 1.78"" AMOLED Bluetooth Calling Smartwatch with 368 * 448 Pixel Resolution, Rotating Crown & 60Hz Refresh Rate 100+ Sports Mode, TWS Connection, Voice Assistance (Silver)  ","3,799",4.3,"₹3,799",Fire-Boltt
Antique Day & Date Leather Strap Analog Watch for Men & Boys  ,299,3.4,₹299,Matrix
"PTron Newly Launched Force X10 Bluetooth Calling Smartwatch with 1.7"" Full Touch Color Display, Real Heart Rate Monitor, SpO2, Watch Faces, 5 Days Runtime, Fitness Trackers & IP68 Waterproof (Pink)  ","1,099",3.2,"₹1,099",pTron
Analog Boy's & Men's Watch (Blue Dial Blue Colored Strap)  ,266,3.6,₹266,REDUX
"PTron Newly Launched Force X10 Bluetooth Calling Smartwatch with 1.7"" Full Touch Color Display, Real Heart Rate Monitor, SpO2, Watch Faces, 5 Days Runtime, Fitness Trackers & IP68 Waterproof (Blue)  ","1,099",3.2,"₹1,099",pTron
Black Dial Analogue Watch for Men Pack of 1 (FULLBLKPAYDU)  ,265,3.6,₹265,Acnos
New Edition i7 Pro Max All in One Series 7 Smart Watch with Fitness Tracker Heart Monitor Men Women Smart Watch Black  ,619,3.1,₹619,Generic
"boAt Matrix Smart Watch with 1.65” AMOLED Display, Always On Mode, Slim Premium Design, Heart Rate & SpO2 Monitoring, Health Ecosystem & Multiple Sports Modes, 3ATM & 7 Days Battery Life(Pitch Black)  ","1,499",3.9,"₹1,499",boAt
Men's Military Digital Watches Analog Quartz Waterproof Watch Sport Multifunctional Leather Wristwatch  ,"3,152",4.5,"₹3,152",NAVIFORCE
"OLICOM M1 Smart Watch Id-116 Bluetooth Smartwatch Wireless Fitness Band for Boys, Girls, Men, Women & Kids | Sports Gym Watch for All Smart Phones I Heart Rate and spo2 Monitor  ",499,3.6,₹499,OLICOM
The Watch (Fourteen Tales of Thirteen Covens Book 5)  ,0,5.0,₹0,Audrey Brice
Analog Men's Watch  ,999,4.1,₹999,TIMEX
Men's Military Digital Watches Analog Quartz Waterproof Watch Sport Multifunctional Leather Wristwatch  ,"3,152",4.5,"₹3,152",NAVIFORCE
"SENS NUTON 1 with 1.7 IPS Display, Orbiter, 5ATM & 150+ Watch Faces & Free Additional Strap (Royal Silver)  ","1,099",3.9,"₹1,099",SENS
Square Multi DIAL Analog Silicon Strap ADDI Stylish Designer Analog Watch - for Boys  ,189,3.5,₹189,SWADESI STUFF
Magnetic Charging Cable Compatible with Dizo Watch 2/Watch 2 Sport/Dizo Watch S/Dizo Watch D (Watch 2/Watch D/S)  ,299,5.0,₹299,ZOVC
Axial Digital Black Dial Men's Watch-DZT2017  ,"10,397",3.8,"₹10,397",Diesel
Analog Men's Watch (Brown Dial Brown Colored Strap)  ,339,3.6,₹339,SWISSTONE
Smart Watch for Men Women ID116 Plus Smart Bracelet Fitness Tracker Color Screen Smartwatch Heart Rate Blood Pressure Pedometer Sleep Monitor  ,399,4.4,₹399,Mobivax
"Fire-Boltt Ninja 3 1.83"" Display Smartwatch Full Touch with 100+ Sports Modes with IP68, Sp02 Tracking, Over 100 Cloud Based Watch Faces (Beige)  ","1,299",4.2,"₹1,299",Fire-Boltt
Classy Look Blue Dial and Brown Chain Analog Watch for Men Boys  ,329,3.7,₹329,PIRASO
"Fire-Boltt Ninja Call Pro Smart Watch Dual Chip Bluetooth Calling, 1.69"" Display, AI Voice Assistance with 100 Sports Modes, with SpO2 & Heart Rate Monitoring (Navy Blue)  ","1,699",4.2,"₹1,699",Fire-Boltt
Watch for Boys and Girl Spider Men Kids Light Glowing Watch with Music Tune and Face Cover Multicolor Led Digital Light Kid Watch (3-9 Year Red  ,299,3.8,₹299,Lionmati
Ladies Neo-Ii Analog Blue Dial Women's Watch-NL2481SL08  ,"1,596",4.4,"₹1,596",Titan
"Fire-Boltt Visionary 1.78"" AMOLED Bluetooth Calling Smartwatch with 368 * 448 Pixel Resolution, Rotating Crown & 60Hz Refresh Rate 100+ Sports Mode, TWS Connection, Voice Assistance (Silver)  ","3,799",4.3,"₹3,799",Fire-Boltt
"Noise ColorFit Ultra Buzz Bluetooth Calling Smart Watch with 1.75"" HD Display, 320x385 px Resolution, 100 Sports Modes, Stock Market Info Smartwatch for Men & Women (Champagne Grey)  ","1,999",4.1,"₹1,999",Noise
"Fire-Boltt Ninja Call Pro Plus 1.83"" Smart Watch with Bluetooth Calling, AI Voice Assistance, 100 Sports Modes IP67 Rating, 240 * 280 Pixel High Resolution (Gold Black)  ","1,699",4.3,"₹1,699",Fire-Boltt
Silicone Strap Black Dial Watch for Men | Watches for Boys | Stylish Analog Watches for Men  ,"1,499",4.5,"₹1,499",Sylvi
Karishma Analog Black Dial Men's Watch-NL1636SM01  ,"2,615",4.1,"₹2,615",Titan
Analog Silver Men Watch 3229SM02 / 3229SM02  ,"1,524",4.3,"₹1,524",Fastrack
"Maxima Max Pro Sky 1.85"" HD Smart Watch with Bluetooth Calling, AI Voice Assistant, Add Personalised QR, Always ON Display for 30 Min, HR/SpO2/Stress/Sleep Monitor, 550Nits Brightness (Midnight Black)  ","1,899",5.0,"₹1,899",Maxima
Analog Black Dial Men's Watch-TW000R433  ,"1,188",4.1,"₹1,188",TIMEX
"DIZO Watch D2 Power (by realme TechLife) –Large 1.91"" Superlight, Single Chipset Bluetooth Calling Smartwatch with Smart Swipe,150 +Stylish Watch Faces and 10 Day Battery (Classic Black)  ","1,799",3.7,"₹1,799",DIZO
"MAGBOT Q9 Smart Watch for Men & Women Latest Bluetooth 1.3"" LED with Daily Activity Tracker, Heart Rate Sensor, BP Monitor, Sports Gym Watch for All Boys & Girls - Black  ",499,3.6,₹499,MAGBOT
Unisex Elegant Plane Style Digital Display Waterproof Outdoor Sports Silicone Strap LED Wrist Watch ( black )  ,390,3.4,₹390,FANMIS
VMBS A1 Smart Watch Mobile Inbuild Camera Supporting 4G/5G Sim Smartwatch for Phone  ,990,2.5,₹990,VMBS
"Digital 24 Images Projector Watch for Kids Boys Watch, Diwali Gift, Birthday Return Gift, Best Digital Toy Watch for Boy's & Girl's BG-906  ",289,4.0,₹289,ADAMO
Analog Dial Black Metal Strap Watch Series Watches for Men Watch for Man and Watch for Boys  ,284,3.5,₹284,The Shopoholic
Analog Men's Watch  ,999,4.1,₹999,TIMEX
Analogueue - Digital Men's & Boy's Watch (Black Dial)  ,749,3.8,₹749,V2A
"DIZO Watch D2 Power (by realme TechLife) – Large 1.91"" Superlight, Single Chipset Bluetooth Calling Smartwatch with Smart Swipe, 150+Stylish Watch Faces and 10 Day Battery (Steel Grey)  ","1,799",3.7,"₹1,799",DIZO
Multi Dial Square 6 Crono Stylish Latest Generation Designer Rubber Strap Analog Watch - for Boys & Girls  ,189,3.4,₹189,SWADESI STUFF
"New LED Watch for Boys, Girls and Kids Digital Black Dial Led Watch for Kids Unisex Birthday Gift Digital Watch  ",100,3.9,₹100,BITZAG
"MARVIK Smart Watch D116 for Xiaomi Mi Note 9 Smart Watch Bluetooth SmartWatch with Activity Tracker, Heart Rate Sensor, Sleep Monitor and Basic Functionality for All Boys & Girls  ",449,3.1,₹449,MARVIK
Multi Functional Sports Digital Multicolor Dial Men's Watch  ,199,3.6,₹199,ASGARD
Lapster USB all types smartwatch charger cable for boat watch charger & boat xtend watch charger & boat storm watch charger- All 2 Pin Watch (Cable Only)  ,113,3.4,₹113,LS LAPSTER Quality Assured
New Fastrack Reflex Beat+ 1.69” UltraVU Display|500 Nits Brightness|60 Sports Modes|24*7 Heart Rate Monitor|SpO2 Monitor|Sleep Tracker|IP68 Water Resistant|Music & Camera Control  ,"1,694",3.9,"₹1,694",Fastrack
Kids Black Dial Digital Watch Date and Time Watch with M4 White Band Watch for Kids Boys and Girls (Pack of-2) (White) (White)  ,279,No reviews,₹279,Oculus
"Maxima Max Pro X4+ Rugged Bluetooth Calling Smart Watch 1.32"" Round Always on Premium Display with 360x360 px Resolution, AI Voice Assitant, Advance UI, 340 mah Big Battery, HR/SpO2, 150+ Watch Faces  ","2,599",3.7,"₹2,599",
"Smart Watch for men women boys 1.3"" OLED HD Display, Multiple watch Faces, SpO2 Monitoring, Sleep Monitor for Boys, Girls, Mens, Women & Kids for all Smartphones (ID 116 Plus Black) (ID116 Black)  ",449,4.5,₹449,LOCREST
Digital Dial Men's & Women's Watch(AB206-VSD)  ,299,2.3,₹299,CERO
Analog White Dial Men's Watch-7135SL03/NP7135SL03  ,700,4.2,₹700,Sonata
Analogue Multicolor Dial 11 Belt Watches for Girls  ,189,3.5,₹189,SWADESI STUFF
Classics Analog White Dial Men's Watch-A300  ,537,4.2,₹537,TIMEX
i8 Pro Max Touch Screen Bluetooth Smartwatch with Activity Tracker Compatible with All 3G/4G/5G Android & iOS Smartphones - Black  ,919,2.9,₹919,Generic
Conquest Black Smile DAIL Unique RC- 5024 Analog Watch - for Men  ,99,No reviews,₹99,Generic
"Apple Watch SE (2nd Gen) [GPS 40 mm] Smart Watch w/Midnight Aluminium Case & Midnight Sport Band. Fitness & Sleep Tracker, Crash Detection, Heart Rate Monitor, Retina Display, Water Resistant  ","28,405",4.6,"₹28,405",Apple
Diamond Studded Stylish Analogue Watch with Rose Gold Dot Bracelet for Girls & Women  ,240,3.8,₹240,ZUPERIA
Analogue Blue Black and Brown Color Dial Day and Date Boy's and Men's Watch  ,249,3.7,₹249,Espoir
"CrossBeats Ignite S5 Advanced AI ENC BT Calling Smartwatch, 1.96” Super AMOLED Anti-Glare Screen, Always on Display, Calculator, 500+ Watch Faces, 360 Degree Health Tracking, Fast Charge (Silver)  ","4,999",4.1,"₹4,999",CrossBeats
"Hammer Pulse Ace Pro Bluetooth Calling Smartwatch with SpO2 & 1.81” Aluminium Alloy Body with Blood Oxygen Monitoring, Heart Rate, Full Touch & Multiple Watch Faces with Customization (Black)  ","1,798",3.7,"₹1,798",Hammer
Analogue Men's Watch Vills Black Dial  ,310,3.7,₹310,PIRASO
Venus Digital Grey Dial Men's Watch-NL7982PP01/NM7982PP01  ,499,4.1,₹499,SF
Watch: A Novel  ,939.,4.6,₹939.86,Keith Buckley
"Redmi Watch 2 Lite - 3.94 cm Large HD Edge Display, Multi-System Standalone GPS, Continuous SpO2, Stress & Sleep Monitoring, 24x7 HR, 5ATM, 120+ Watch Faces, 100+ Sports Modes, Women's Health, Blue  ","2,499",3.9,"₹2,499",Redmi
Analogue Boy's Watch (Blue Dial Blue Colored Strap)  ,119,3.3,₹119,RPS FASHION WITH DEVICE OF R
Formal Analog Black Dial Men's Watch NM7924NM01/NN7924NM01  ,"1,599",4.2,"₹1,599",Sonata
"AYL Waterproof D-20 Touch Screen Smart Watch Bluetooth Smartwatch with Blood Pressure Tracking, Heart Rate Sensor and Basic Functionality for All Women and Girls (Pink)  ",470,3.3,₹470,AYL
Brand - A Digital Watch Shockproof Multi-Functional Automatic 5 Color Army Strap Waterproof Digital Sport's Watches for Men's Kids Watch for Boys - Watches for Men  ,275,3.7,₹275,Acnos
Analog White Dial Unisex's Watch-NG38021PP10W / NG38021PP10W  ,636,4.2,₹636,Fastrack
3022 Men's Multi-Function Analogue - Digital Sport Watch (Black)  ,999,3.9,₹999,Sylvi
"Fire-Boltt Eterno 1.99"" Largest Display, Bluetooth Calling Smartwatch with 1184mm Display Area, AI Voice Assistant, 120+ Sports Modes (Yoga) with Smart Split Screen to Toggle between functions (Black)  ","2,499",4.2,"₹2,499",Fire-Boltt
Chronograph Men's Watch (Black Dial)  ,"12,995",4.3,"₹12,995",Armani Exchange
Sporty Digital Grey Dial Men's Watch-NL77043PP02/NP77043PP02  ,447,4.0,₹447,SF
"CrossBeats Newly launched Ignite S5 Advanced AI ENC BT Calling Smartwatch, 1.96” Super AMOLED Anti-Glare Screen, Always on Display, SnapCharge™ Calculator, 500+ Watch Faces, AI Health Feature (Black)  ","4,999",4.1,"₹4,999",CrossBeats
"Kids Sports Digital Watch, Multi Function Digital Kids Watches Waterproof LED Light Wristwatches for Boys Girls - 1451  ",840,4.2,₹840,SKMEI
Decker Chronograph Black Dial Men's Watch-CH2573P  ,"5,845",4.4,"₹5,845",Fossil
Analog Silver Dial Men's Watch-NL1584SL03/NP1584SL03  ,"2,396",4.3,"₹2,396",Titan
Analog Brown Dial Unisex's Watch-TW00PR214  ,"2,997",4.2,"₹2,997",TIMEX
Diamond Studded Stylish Analogue Watch with Rose Gold Dot Bracelet for Girls & Women  ,240,3.8,₹240,ZUPERIA
Black Round Diamond Dial with Latest Generation Purple & Rosegold Magnet Belt Analogue Watch for Women Pack of - 2 (DM-PURPLE-ROSEGOLD05)  ,345,3.8,₹345,Acnos
Neo Analog Black Dial Men's Watch-1805NM02  ,"6,495",4.5,"₹6,495",Titan
"Waterproof D20 Touchscreen Smart Watch Bluetooth Smartwatch with Blood Pressure Tracking, Heart Rate Sensor and Basic Functionality for All Women and Men  ",332,2.6,₹332,Generic
Classics Analog White Dial Women's Watch-B300  ,537,4.2,₹537,TIMEX
New Watch for Men Branded Savannah Edition Full Black Watch with King Bracelet Analog Watches Black Colour Dial Watch for Men Stylish Watch for Boys Watches for Men Watch Men  ,239,3.8,₹239,MARCLEX
Beta Analog Black Dial Men's Watch-AR1863  ,"11,698",3.9,"₹11,698",Emporio Armani
Analog Black Dial Men's Watch NM7987YL03W/NN7987YL03W  ,559,4.1,₹559,Sonata
Men's Avenger Print Dial Analog Watches (Black)  ,209,3.7,₹209,CERO
"AYL Smart Watch New Generation for You ID116 Touchscreen Android Smart Watch Bluetooth Smartwatch with Heart Rate Sensor and Basic Functionality for All Women, Men, Boys & Girls - Black  ",499,3.4,₹499,AYL
"Noise ColorFit Pro 4 Max 1.8"" Biggest Display, Bluetooth Calling Smart Watch, Built.in Alexa, 100 Sports Modes, Detection, Health & Productivity Suite (Jet Black)  ","3,799",4.0,"₹3,799",Noise
"Zebronics DRIP Smart Watch with Bluetooth Calling, 4.3cm (1.69""), 10 built-in & 100+ Watch Faces, 100+ Sport Modes, 4 built-in Games, Voice Assistant, 8 Menu UI, Fitness Health & Sleep Tracker (Black)  ","1,799",3.8,"₹1,799",ZEBRONICS
Digital Grey Dial Men's Watch-NL77072PP02/NP77072PP02  ,599,4.3,₹599,Sonata
Analogue Black Dial Men's Watch  ,"4,799",3.5,"₹4,799",FORSINING
"Gen 6 Smartwatch with AMOLED Screen, Snapdragon 4100+ Wear Platform, Wear OS by Google, Google Assistant, SpO2, Wellness Features and Smartphone Notifications  ","24,995",4.0,"₹24,995",Fossil
"boAt Wave Lite Smartwatch with 1.69 Inches(4.29cm) HD Display, Heart Rate & SpO2 Level Monitor, Multiple Watch Faces, Activity Tracker, Multiple Sports Modes & IP68 (Scarlet Red)  ","1,499",3.9,"₹1,499",boAt
Essentials Analog White Dial Women's Watch-NM87020SL01W / NL87020SL01W/NP87020SL01W  ,749,4.2,₹749,Sonata
Xtreme Gear Analog-Digital Grey Round Dial Men's Sport Watch-77070PP07  ,"2,899",4.1,"₹2,899",SF
A500  ,777,4.1,₹777,TIMEX
Boy's Avenger Printed Analog Watch and King Bracelet Combo (Black)  ,249,3.7,₹249,CERO
sunway M3 Silicone LED Digital Black Men's Women's Watch  ,100,2.8,₹100,sunway
Analogue Men's Watch (Silver Dial Silver Colored Strap)  ,322,3.9,₹322,AUREX
Slim Case Full Black Analogue Watch for Boy's and Men's Pack of - 1  ,245,2.9,₹245,Acnos
Essentials Analog Silver Dial Men's Watch NM77082SL01W/NN77082SL01W  ,639,4.3,₹639,Sonata
Brand - A Digital Watch Shockproof Multi-Functional Automatic 5 Color Army Strap Waterproof Digital Sport's Watch for Men's Kids Watch for Boys - Watch for Men  ,275,3.8,₹275,Acnos
RPM Analog Grey Dial Men's Watch-NN77031SL03/NP77031SL03  ,"1,699",4.0,"₹1,699",Sonata
"Fire-Boltt Ninja Calling 1.69"" Bluetooth Calling Smart Watch, Dial Pad, Speaker, AI Voice Assistant, 450 NITS Peak Brightness, Wrist Gaming & 100+ Watch Faces with SpO2, Multiple Sports (Rose Gold)  ","1,999",4.2,"₹1,999",Fire-Boltt
Analog Dial Men's Watch  ,"5,244",4.1,"₹5,244",Tommy Hilfiger
"Smart 2 Fashion Smartwatch, 1.78” AMOLED Display with Premium Metal Body, Multiple Sports Modes with 100+ Watchfaces, Complete Health Suite with Stress Monitor, 7 Days Battery Life & 3 ATM  ","5,995",3.9,"₹5,995",Titan
Brand - A Digital Watch Shockproof Multi-Functional Automatic 5 Color Army Strap Waterproof Digital Sport's Watch for Men's Kids Watch for Boys - Watch for Men  ,275,3.8,₹275,Acnos
"Pebble Cosmos Endure 1.46"" AMOLED Always-On Display Bluetooth Calling IP68 Waterproof Smartwatch 466 * 466 (Glacier Blue)  ","4,499",4.4,"₹4,499",Pebble
New Fastrack Reflex Beat+ 1.69” UltraVU Display|500 Nits Brightness|60 Sports Modes|24*7 Heart Rate Monitor|SpO2 Monitor|Sleep Tracker|IP68 Water Resistant|Music & Camera Control  ,"1,694",3.9,"₹1,694",Fastrack
Analog Dial Men's Watch  ,"5,244",4.1,"₹5,244",Tommy Hilfiger
"IMOO Watch Phone Z1 Kids Smart Watch, 4G Kids Smartwatch Phone with Long-Lasting Video & Phone Call, Kids GPS Watch with Real-time Locating & IPX8 Water-Resistance (Pink)  ","9,990",4.3,"₹9,990",IMOO
Super Fibre Digital Grey Dial Men's Watch-NL87011PP04/NP87011PP04  ,600,4.1,₹600,Sonata
3022 Men's Multi-Function Analogue - Digital Sport Watch (Black)  ,999,3.9,₹999,Sylvi
"boAt Blaze Smart Watch with 1.75” HD Display, Fast Charge, Apollo 3 Blue Plus Processor, 24x7 Heart Rate & SpO2 Monitor, Multiple Watch Faces, Multiple Sports Modes & 7 Days Battery Life(Deep Blue)  ","1,299",3.8,"₹1,299",boAt
The Watch (Red Book 1)  ,446,4.5,₹446,Amanda Witt
Beyond Gold Analog Black Dial Men's Watch-NN77031KM03/NP77031KM03  ,"2,149",4.3,"₹2,149",Sonata
Slim Case Full Black Analogue Watch for Boy's and Men's Pack of - 1  ,245,2.9,₹245,Acnos
Casual Analog Navy Blue Dial Men's Watch NM3120SM02/NN3120SM02/NP3120SM02  ,"1,480",4.3,"₹1,480",Fastrack
Zaha New Generation Digital Square Watch for Boys & Girls & Kids (Red)  ,139,5.0,₹139,Generic
Jacqueline Analog White Dial Women's Watch - ES3843  ,"8,995",4.5,"₹8,995",Fossil
Analog Blue Dial Unisex's Watch-NN26006PP01W/NP26006PP01W  ,699,4.4,₹699,Titan
Boy's Avenger Printed Analog Watch and King Bracelet Combo (Black)  ,249,3.7,₹249,CERO
Analog-Digital Black Dial Men's Watch-NL38035SL03/NP38035SL03  ,"3,596",4.2,"₹3,596",Fastrack
Black Round Diamond Dial with Latest Generation Purple & Rosegold Magnet Belt Analogue Watch for Women Pack of - 2 (DM-PURPLE-ROSEGOLD05)  ,345,3.8,₹345,Acnos
Unisex Swiss True High Tech Analogue Ceramic Watch (White)  ,"2,999",No reviews,"₹2,999",Maicrogear
Analog Gold Dial Men's Watch NM7987YL01W/NN7987YL01W/NP7987YL01W  ,562,4.1,₹562,Sonata
Essentials Analog Black Dial Men's Watch-NN77082SM01/NP77082SM01  ,825,4.3,₹825,Sonata
Analog Men's Watch (Gold Dial Gold Colored Strap)  ,389,3.2,₹389,VILLS LAURRENS
Beta Analog Black Dial Men's Watch-AR1863  ,"11,698",3.9,"₹11,698",Emporio Armani
Analog Men's Watch  ,848,4.1,₹848,TIMEX
Swiss True High Tech Analogue Ceramic Watch for Men Black Dial.  ,"3,299",4.7,"₹3,299",Maicrogear
"Apple Watch Ultra [GPS + Cellular 49 mm] Smart Watch w/Rugged Titanium Case & Green Alpine Loop - Small. Fitness Tracker, Precision GPS, Action Button, Extra-Long BatteryLife, Brighter Retina Display  ","82,899",4.2,"₹82,899",Apple
"Apple Watch SE (2nd Gen) [GPS 44 mm] Smart Watch w/Starlight Aluminium Case & Starlight Sport Band. Fitness & Sleep Tracker, Crash Detection, Heart Rate Monitor, Retina Display, Water Resistant  ","29,900",4.6,"₹29,900",Apple
Lionmati Ben 10 face Light Glowing Disco Kids Watch for Boys Multicolor Digital Light Watch for Boys and Girl {3-9 Year Green  ,287,4.5,₹287,Generic
"Fire-Boltt Invincible 1.43"" AMOLED Display Smartwatch with Bluetooth Calling, TWS Connection, 300+ Sports Modes, 110 in-Built Watch Faces, 4GB Storage & AI Voice Assistant (Silver)  ","4,499",4.3,"₹4,499",Fire-Boltt
Casual Analogue Women's Watch(Black Dial Black Colored Strap)-Queenmeg  ,209,3.6,₹209,CERO
Fastrack Reflex Hello Smart Watch with BT Calling|Bright HD Display|AI Voice Assistant|50+ Sports Modes|100+ Watchfaces|BP Monitor|24x7 HRM| SpO2|Upto 5 Day Battery|Camera & Music Control|IP68  ,"3,994",3.8,"₹3,994",Fastrack
Essentials Analog White Dial Men's Watch NM77083SM01 / NL77083SM01  ,879,4.2,₹879,Sonata
LED Multi Function Silicon Strap Black Dial Digital Sport Watch for Men and Boys  ,249,3.5,₹249,SWADESI STUFF
Karishma Analog Black Dial Men's Watch-NK1578SM04 / NK1578SM04  ,"1,596",4.3,"₹1,596",Titan
"PTron Force X12N 1.85"" Full Touch HD Display Bluetooth Calling Smartwatch, Functional Crown, 580 NITS Brightness, HR, SpO2, Watch Faces, Inbuilt Games, 5 Days Battery Life & IP68 Waterproof (Blue)  ","1,549",3.8,"₹1,549",pTron
Zaha New Generation Digital Square Watch for Boys & Girls & Kids (Sky)  ,149,1.9,₹149,Generic
"Prolet 20mm Nylon Sport Replacement Bands and Loop Compatible With (ONLY 20mm Lugs Size) Amazfit GTS 2 Mini, Amazfit Bip,Amazfit GTS,Samsung Galaxy Watch 4/ Watch 5-(Black)  ",299,4.1,₹299,Prolet
Silver Linings Analog Black Dial Women's Watch-NN87029NL02/NP87029NL02  ,"1,137",4.0,"₹1,137",Sonata
"Fire-Boltt India's No 1 Smartwatch Brand Ring Bluetooth Calling with SpO2 & 1.7” Metal Body with Blood Oxygen Monitoring, Continuous Heart Rate, Full Touch & Multiple Watch Faces (Blue)  ","2,299",4.1,"₹2,299",Fire-Boltt
Chronograph Men's Watch (Black Dial)  ,"12,995",4.3,"₹12,995",Armani Exchange
"Fire-Boltt Ninja 3 1.83"" Display Smartwatch Full Touch with 100+ Sports Modes with IP68, Sp02 Tracking, Over 100 Cloud Based Watch Faces (Blue)  ","1,299",4.2,"₹1,299",Fire-Boltt
