title,price,rating,oprice,brand
Analog White Dial Women's Watch NM8976YL02W / NL8976YL02W  ,519,4.1,₹519,Sonata
Chronograph Design Multi Analog Combo Watches for Men and Watches for Boys Pack of 3  ,355,3.5,₹355,Acnos
"SENS NUTON 1 with 1.7 IPS Display, Orbiter, 5ATM & 150+ Watch Faces & Free Additional Strap (Matte Black)  ","1,099",3.9,"₹1,099",SENS
Scarlette Mini Analog Gold Dial Women's Watch-ES4319  ,"5,997",4.6,"₹5,997",Fossil
Neo Analog White Dial Men's Watch-NN1805SL04  ,"4,796",4.3,"₹4,796",Titan
"CrossBeats Ignite GRIT Smart Watch, 1.83 AMOLED Display with Advanced Bluetooth Calling, Rotating Crown,AI Health Sensors, 150+ Sports Modes, 250+Watch Faces, in-Built Games, 15 Days Battery-Black  ","2,999",4.3,"₹2,999",CrossBeats
Volt+ Analog Black Dial Men's Watch NM77086PL01 / NL77086PL01/NP77086PL01W  ,875,4.2,₹875,Sonata
RPM Analog Grey Dial Men's Watch-NN77031SL03/NP77031SL03  ,"1,699",4.0,"₹1,699",Sonata
New Fastrack Reflex Beat+ 1.69” UltraVU Display|500 Nits Brightness|60 Sports Modes|24*7 Heart Rate Monitor|SpO2 Monitor|Sleep Tracker|IP68 Water Resistant|Music & Camera Control  ,"1,694",3.9,"₹1,694",Fastrack
Karishma Analog Black Dial Men's Watch-NK1578SM04 / NK1578SM04  ,"1,596",4.3,"₹1,596",Titan
Xtreme Gear Analog-Digital Grey Round Dial Men's Sport Watch-77070PP07  ,"2,899",4.1,"₹2,899",SF
"Apple Watch SE (2nd Gen) [GPS 40 mm] Smart Watch w/Midnight Aluminium Case & Midnight Sport Band. Fitness & Sleep Tracker, Crash Detection, Heart Rate Monitor, Retina Display, Water Resistant  ","28,405",4.6,"₹28,405",Apple
Karishma Analog Black Dial Men's Watch-NL1639SM02/NN1639SM02  ,"1,596",4.3,"₹1,596",Titan
Black dial-case and Black Leather Watch for Men Pack of - 1  ,245,3.4,₹245,Acnos
"CrossBeats Ignite GRIT Smart Watch, 1.83 AMOLED Display with Advanced Bluetooth Calling, Rotating Crown,AI Health Sensors, 150+ Sports Modes, 250+Watch Faces, in-Built Games, 15 Days Battery-Pink  ","2,999",4.3,"₹2,999",CrossBeats
"MARVIK Smart Watch D116 for Xiaomi Mi Note 10 Smart Watch LED with Activity Tracker, Heart Rate Sensor, Sleep Monitor and Basic Functionality for All Boys Girls  ",499,3.1,₹499,MARVIK
Lapster USB all types smartwatch charger cable for boat watch charger & boat xtend watch charger & boat storm watch charger- All 2 Pin Watch (Cable Only)  ,113,3.4,₹113,LS LAPSTER Quality Assured
Analogue Boy's Watch (White Dial Pink Colored Strap)  ,119,3.9,₹119,RPS FASHION WITH DEVICE OF R
Reflex Vybe Smartwatch Bright HD Display 50+ Sports Modes in-Built Games 100+ Watchfaces BP Monitor 24x7 HRM SpO2 Sleep Tracker 100+ Watchfaces Upto 5 Day Battery IP68 (Black)  ,"2,995",3.6,"₹2,995",Fastrack
The Watch  ,0,4.0,₹0,Raitt Emmel Hall
Black Magic Analog Black Dial Men's Watch NM3089SL05/NN3089SL05/NP3089SL05  ,"2,236",4.2,"₹2,236",Fastrack
Slim Case Full Black Analogue Watch for Boy's and Men's Pack of - 1  ,245,2.9,₹245,Acnos
Beta Analog Black Dial Men's Watch-AR1863  ,"11,698",3.9,"₹11,698",Emporio Armani
Analog Gold Dial Women's Watch-TW000Q810  ,"2,637",4.4,"₹2,637",TIMEX
Analog Women's Watch (Black Dial Gold Colored Strap)  ,357,4.0,₹357,SWISSTONE
Analog Black Dial Men's Watch-TW000U914  ,"2,457",4.4,"₹2,457",TIMEX
"Fire-Boltt Visionary 1.78"" AMOLED Bluetooth Calling Smartwatch with 368 * 448 Pixel Resolution, Rotating Crown & 60Hz Refresh Rate 100+ Sports Mode, TWS Connection, Voice Assistance (Gold)  ","3,799",4.3,"₹3,799",Fire-Boltt
Analog Dial Women's Watch  ,"2,780",4.2,"₹2,780",French Connection
Trendies Analog Black Dial Men's Watch-NL38048PP01  ,"2,295",4.3,"₹2,295",Fastrack
Super Fibre Digital Grey Dial Men's Watch-NL87011PP04/NP87011PP04  ,600,4.1,₹600,Sonata
Analogue Watch for Men and Boys  ,249,3.6,₹249,SWADESI STUFF
"New LED Watch for Boys, Girls and Kids Digital Black Dial Led Watch for Kids Unisex Birthday Gift Digital Watch  ",100,3.9,₹100,BITZAG
PU Belt Analogue Men's Watch and Boy's Watch  ,195,5.0,₹195,PAPIO
"APCSA Smart Watch for Men & Women Latest Bluetooth 1.3"" LED with Daily Activity Tracker, Heart Rate Sensor, BP Monitor, Sports Gym Watch for All Boys & Girls - Pink  ",599,3.4,₹599,APCSA
Analog Black Dial Men's Watch-TW000U934  ,"2,160",4.2,"₹2,160",TIMEX
Analog Multi-Colour Dial Children's Watch-NLC3030PP05/NPC3030PP05W  ,795,4.3,₹795,Zoop
Essentials Analog White Dial Women's Watch-NM87020SL01W / NL87020SL01W/NP87020SL01W  ,749,4.2,₹749,Sonata
Casual Analog Dial Men's Watch -NM3124SL02 / NL3124SL02/NP3124SL02  ,"1,436",4.2,"₹1,436",Fastrack
Analog White Dial Unisex-Adult Watch-38003PP22  ,950,4.6,₹950,Fastrack
Essentials Analog Black Dial Men's Watch-NN77082SM01/NP77082SM01  ,825,4.3,₹825,Sonata
Analog White Dial Men's Watch-NL1639SL03  ,"1,995",4.1,"₹1,995",Titan
Black Skeleton Business Wrist Watches Stainless Steel Band Mechanical Watch for Man  ,"3,999",M.R.P: ,"₹3,999",FORSINING
Classics Analog White Dial Men's Watch-A303  ,777,4.2,₹777,TIMEX
Smart Plaid Analog White Dial Men's Watch-NN77105SL01W/NP77105SL01W  ,"1,075",4.2,"₹1,075",Sonata
Economy 2013 Analog Black Dial Men's Watch-NL3099SM04/NP3099SM04  ,"2,795",4.0,"₹2,795",Fastrack
Ladies Neo-Ii Analog Blue Dial Women's Watch-NL2569SM01  ,"4,795",4.4,"₹4,795",Titan
Diamond Studded Stylish Analogue Watch with Rose Gold Dot Bracelet for Girls & Women  ,240,3.8,₹240,ZUPERIA
Digital Grey Dial Men's Watch-NL77072PP02/NP77072PP02  ,599,4.3,₹599,Sonata
Analog-Digital Black Dial Men's Watch-NL77070PP06/NP77070PP06  ,"2,899",4.2,"₹2,899",SF
Upgrade-Core Analog White Dial Women's Watch-NM2298SM01 / NL2298SM01/NP2298SM01  ,"1,850",4.1,"₹1,850",Fastrack
Neo Analog Blue Dial Men's Watch-NM1733KL03 / NL1733KL03/NP1733KL03  ,"5,795",4.3,"₹5,795",Titan
Analog Blue Dial Men's Watch-TW0TG6107  ,"2,307",3.9,"₹2,307",TIMEX
Casual Analog Navy Blue Dial Men's Watch NM3120SM02/NN3120SM02/NP3120SM02  ,"1,480",4.3,"₹1,480",Fastrack
Digital Kid's Watch (Dial Colored Strap)  ,324,4.1,₹324,SHASHIKIRAN
Superfibre Digital Grey Dial Men's Watch NM77034PP03 / NL77034PP03/NP77034PP03  ,"1,349",4.3,"₹1,349",Sonata
Hadwin Silicone Watch Straps Compatible with Goqii Smart Vital Fitness Spo2 Smart Watch (Black)  ,259,4.5,₹259,Hadwin
Analogue Men's Watch(Black Dial Mens Standard Colored Strap)-BIG-BLACK-MAGNET  ,349,3.2,₹349,CERO
Watch for Boys and Girl Spider Men Kids Light Glowing Watch with Music Tune and Face Cover Multicolor Led Digital Light Kid Watch (3-9 Year Red  ,299,3.8,₹299,Lionmati
Superfibre Digital Grey Dial Men's Watch NM77034PP03 / NL77034PP03/NP77034PP03  ,"1,349",4.3,"₹1,349",Sonata
Analog Blue Dial Women's Watch NM8989PP04 / NL8989PP04  ,525,4.0,₹525,Sonata
Slim Case Full Black Analogue Watch for Boy's and Men's Pack of - 1  ,245,2.9,₹245,Acnos
analog White Dial Men's Watch NM7078YM01/NN7078YM01  ,"1,149",4.3,"₹1,149",Sonata
Black Round Diamond Dial with Latest Generation Purple & Rosegold Magnet Belt Analogue Watch for Women Pack of - 2 (DM-PURPLE-ROSEGOLD05)  ,345,3.8,₹345,Acnos
Zaha New Generation Digital Square Watch for Boys & Girls & Kids (Red)  ,139,5.0,₹139,Generic
"CrossBeats Ignite GRIT Smart Watch, 1.83 AMOLED Display with Advanced Bluetooth Calling, Rotating Crown,AI Health Sensors, 150+ Sports Modes, 250+Watch Faces, in-Built Games, 15 Days Battery-Black  ","2,999",4.3,"₹2,999",CrossBeats
Digital Bluish Grey Dial Children's Watch NLC3026PP02W / NLC3026PP02W/NPC3026PP02  ,940,4.4,₹940,Zoop
Analog White Dial Unisex-Adult Watch-38003PP22  ,950,4.6,₹950,Fastrack
Analog Black Dial Men's Watch-MTP-VT01L-1BUDF (A1615)  ,"2,498",4.3,"₹2,498",Casio
"Fire-Boltt India's No 1 Smartwatch Brand Ring Bluetooth Calling with SpO2 & 1.7” Metal Body with Blood Oxygen Monitoring, Continuous Heart Rate, Full Touch & Multiple Watch Faces (Blue)  ","2,299",4.1,"₹2,299",Fire-Boltt
Multi Function Kids Digital Watch for Boys  ,249,3.6,₹249,SWADESI STUFF
Fundamentals Analog Blue Dial Men's Watch-NN38051SM03  ,"1,356",4.3,"₹1,356",Fastrack
"Fire-Boltt Ninja Fit Smartwatch Full Touch 1.69 & 120+ Sports Modes with IP68, Multi UI Screen, Over 100 Cloud Based Watch Faces, Built in Games (Black)  ","1,299",4.2,"₹1,299",Fire-Boltt
Boy's Avenger Printed Analog Watch and King Bracelet Combo (Black)  ,249,3.7,₹249,CERO
Analog Blue Dial Women's Watch-TW000X215  ,"2,637",4.4,"₹2,637",TIMEX
Watch (Malayalam Edition)  ,0,4.0,₹0,Sajith Krishnan
Analog Champagne Dial Stainless Steel Strap Men's Watch - 1650YM06  ,"2,995",4.3,"₹2,995",Titan
Analog Men's Watch (Gold Dial Gold Colored Strap)  ,389,3.2,₹389,VILLS LAURRENS
Beta Analog Black Dial Men's Watch-AR1863  ,"11,698",3.9,"₹11,698",Emporio Armani
"IMOO Watch Phone Z1 Kids Smart Watch, 4G Kids Smartwatch Phone with Long-Lasting Video & Phone Call, Kids GPS Watch with Real-time Locating & IPX8 Water-Resistance (Pink)  ","9,990",4.3,"₹9,990",IMOO
Bikers Analog White Dial Men's Watch-NL3022SL01/NP3022SL01  ,"3,595",4.2,"₹3,595",Fastrack
Octane Analog Silver Dial Men's Watch-NL1650BM03/NP1650BM03  ,"3,445",4.3,"₹3,445",Titan
"boAt Xtend Pro with Advanced Dedicated Bluetooth Calling Chip, Dial Pad, 1.78” AMOLED Display, Premium Metal Strap, ASAP™ Charge, 700+ Active Modes, Multiple Watch Faces, Health Ecosystem(Metal Black)  ","2,999",3.8,"₹2,999",boAt
Analog Grey Dial Men's Watch-TW000U905  ,"2,157",4.2,"₹2,157",TIMEX
"Gen 5E Smartwatch with AMOLED Screen, Wear OS by Google, Built-in Speaker for Phone Calls, Google Assistant, SpO2, GPS, NFC, Wellness Features and Smartphone Notifications  ","11,994",3.9,"₹11,994",Fossil
Analog Rose Gold Dial Women's Watch-NM6147NM01 / NL6147NL01/NP6147NM01  ,"2,076",4.3,"₹2,076",Fastrack
Digital Men's and Women Watch DIGITAL-012 (Black Dial Multicolour Strap)  ,249,3.4,₹249,ON TIME OCTUS
"Talk S with 1.78"" AMOLED Display|Advanced BT Calling|Music Storage with Wireless Audio Connect|100+ Sports Modes|Animated Watchfaces|5 Days Battery|IP68 Water Resistant|Stress & Mood Monitor  ","8,994",4.0,"₹8,994",Titan
Economy 2013 Analog Black Dial Men's Watch-NL3099SM04/NP3099SM04  ,"2,795",4.0,"₹2,795",Fastrack
Lionmati Avenger Spiderman Theme Edition Wrist Kids Watch for Boys and Girls Multicolored 3D Disco Led Light Up Boys Watch with Soft Strap and Waterproof Girls Watch Birthday Kids Gifts for Boys  ,299,New to Amazon,₹299,Lionmati
Essentials Analog White Dial Women's Watch-NM87020SL01W / NL87020SL01W/NP87020SL01W  ,749,4.2,₹749,Sonata
Swiss True High Tech Analogue Ceramic Watch for Men Black Dial.  ,"3,299",4.7,"₹3,299",Maicrogear
Mobivax smartwatches id116 Fit Watch for Man Women: Android iOS Sleep Heart Rate Blood Oxygen Weather Breath Training IP68 Waterproof 8 Sports 1.69Inch  ,499,4.0,₹499,Mobivax
Analog Blue Dial Women's Watch-DK11404-4  ,"1,700",4.2,"₹1,700",DANIEL KLEIN
"Smart Watch for Men & Women - ID116 Latest Bluetooth Phone Watch 1.3"" LED with Daily Activity Tracker, Heart Rate Sensor, BP Monitor, Sports Watch for All Boys & Girls - Black  ",479,3.8,₹479,Boxing
"Timex Metalfit SPO2 smartwatch with Full Metal Body and Touch to Wake Feature, HRM, Sleep & Activity Tracker  ","1,198",3.5,"₹1,198",helix
Analog Gold Dial Women's Watch-DK11430-4  ,"2,394",4.2,"₹2,394",DANIEL KLEIN
Karishma Analog Multi-Colour Dial Men's Watch-NL1639SM01/NN1639SM01  ,"1,596",4.4,"₹1,596",Titan
Youth-Digital Black Dial Men's Watch-W-96H-1BVDF (D054)  ,"1,498",4.3,"₹1,498",Casio
Analog Dial Men's Watch  ,"5,244",4.1,"₹5,244",Tommy Hilfiger
Casual Analog Navy Blue Dial Men's Watch NM3120SM02/NN3120SM02/NP3120SM02  ,"1,480",4.3,"₹1,480",Fastrack
"Fire-Boltt Visionary 1.78"" AMOLED Bluetooth Calling Smartwatch with 368 * 448 Pixel Resolution, Rotating Crown & 60Hz Refresh Rate 100+ Sports Mode, TWS Connection, Voice Assistance (Gold)  ","3,799",4.3,"₹3,799",Fire-Boltt
Analog-Digital Black Dial Men's Watch-NL77070PP06/NP77070PP06  ,"2,899",4.2,"₹2,899",SF
Classics Analog White Dial Women's Watch-B300  ,537,4.2,₹537,TIMEX
Enticer Analog Black Dial Men's Watch-MTP-VD01GL-1EVUDF  ,"2,995",4.4,"₹2,995",Casio
Analog-Digital Black Dial Men's Watch-NL77070PP06/NP77070PP06  ,"2,899",4.2,"₹2,899",SF
"CYLECT Smart Watch for Men women - Smart Watches for Men Women, Bluetooth Smartwatch Touch Screen Bluetooth Smart Watches for Android iOS Phones Wrist Phone Watch, Women - pink  ",598,3.7,₹598,CYLECT
Leather Strap Analog Wrist Watch for Women (Black/Brown/Red) - CK312  ,279,3.7,₹279,SWISSTONE
Lionmati Ben 10 face Light Glowing Disco Kids Watch for Boys Multicolor Digital Light Watch for Boys and Girl {3-9 Year Green  ,287,4.5,₹287,Generic
"Apple Watch Ultra [GPS + Cellular 49 mm] smart watch w/Rugged Titanium Case & Green Alpine Loop - Medium. Fitness Tracker, Precision GPS, Action Button, Extra-Long BatteryLife, Brighter Retina Display  ","82,999",4.2,"₹82,999",Apple
"Fire-Boltt Ninja 3 1.83"" Display Smartwatch Full Touch with 100+ Sports Modes with IP68, Sp02 Tracking, Over 100 Cloud Based Watch Faces (Black)  ","1,299",4.2,"₹1,299",Fire-Boltt
Digital Boy's & Men's Watch (Multicolour Dial Multi Colored Strap)  ,231,3.9,₹231,ZUPERIA
Outdoor Sport Shockproof Led Analogue and Digital Waterproof Chronograph Watch for Men  ,990,4.0,₹990,V2A
Youth-Digital Grey Dial Men's Watch-AE-1200WH-1AVDF (D097)  ,"2,595",4.6,"₹2,595",Casio
Metal Chain Analog Wrist Watch for Men (Black/Silver/Blue)  ,459,4.1,₹459,CRESTELLO
Men's Digital Sports Watch 50m Waterproof LED Military Multifunction Smart Watch Stopwatch Countdown Auto Date Alarm - 1251  ,759,4.0,₹759,SKMEI
Analogue Boy's Watch (White Dial Pink Colored Strap)  ,119,3.9,₹119,RPS FASHION WITH DEVICE OF R
Ladies Neo-Ii Analog Blue Dial Women's Watch-NL2569SM01  ,"4,795",4.4,"₹4,795",Titan
"Honor Watch GS 3 Smartwatch with 1.43"" AMOLED Touch Screen, Heart Rate, Sleep and Blood Oxygen, Dual GPS, Bluetooth Calling,14 Days Life, 100+ Diverse Sport Modes, Midnight Black (MUS-B19)  ","9,999",3.9,"₹9,999",Honor
Analog Dial Unisex-Adult's Watch  ,"1,137",4.1,"₹1,137",FCUK
Karishma Revive Analog Silver Dial Women's Watch-NN2593SM01/NP2593SM01  ,"1,720",4.2,"₹1,720",Titan
Octane Analog Silver Dial Men's Watch-NL1650BM03/NP1650BM03  ,"3,445",4.3,"₹3,445",Titan
